match_id,date,match_home_team,latitude_from,longitude_from,next_team,latitude_next,longitude_next,distance_km,avg_talent
Oakland Roots SC vs. New Mexico United,2025-05-24,Oakland Roots SC,37.7255905,-122.2324865,FC Naples,26.168498,-81.685512,0.0869380173562847,0.319213743983787
Westchester SC vs. Richmond Kickers,2025-05-25,Westchester SC,40.711376,-74.004442,Las Vegas Lights FC,36.17879868,-115.1350327,0.181272805362422,0.2649885540512805
Las Vegas Lights FC vs. Phoenix Rising FC,2025-05-28,Las Vegas Lights FC,36.17879868,-115.1350327,Houston Dynamo FC,29.7513,-95.3578,0.5494562219728776,0.3717046904734317
Houston Dynamo FC vs. Sporting Kansas City,2025-05-31,Houston Dynamo FC,29.7513,-95.3578,Birmingham Legion FC,33.5133982,-86.8009311,0.7921135525321197,0.4992984816452047
Birmingham Legion FC vs. Indy Eleven,2025-06-04,Birmingham Legion FC,33.5133982,-86.8009311,Hartford Athletic,41.7539073,-72.661055,0.6481461496359369,0.358630809906949
Hartford Athletic vs. North Carolina FC,2025-06-06,Hartford Athletic,41.7539073,-72.661055,Sacramento Republic FC,38.5616356,-121.4907504,0.0612566921131396,0.3373295695220969
Rhode Island FC vs. Miami FC,2025-06-07,Rhode Island FC,41.8684026,-71.3831786,Spokane Velocity FC,47.667363,-117.420367,0.1691845025923948,0.3972896298420999
Spokane Velocity FC vs. Charlotte Independence,2025-06-11,Spokane Velocity FC,47.667363,-117.420367,Union Omaha,41.15111542,-96.10290527,0.5810861071518786,0.442365986166591
Union Omaha vs. Greenville Triumph SC,2025-06-12,Union Omaha,41.15111542,-96.10290527,One Knoxville SC,35.97233,-83.915533,0.7251168840409565,0.3218279089745502
One Knoxville SC vs. Richmond Kickers,2025-06-13,One Knoxville SC,35.97233,-83.915533,Sacramento Republic FC,38.5616356,-121.4907504,0.242922612007458,0.3315343595790498
Sacramento Republic FC vs. San Antonio FC,2025-06-14,Sacramento Republic FC,38.5616356,-121.4907504,Portland Hearts of Pine,43.6593917,-70.2638855,0.0266444323150512,0.4376095556788217
Portland Hearts of Pine vs. Union Omaha,2025-06-15,Portland Hearts of Pine,43.6593917,-70.2638855,Miami FC,25.7639,-80.1899,0.5032681314820385,0.2854961700165466
Miami FC vs. Charleston Battery,2025-06-18,Miami FC,25.7639,-80.1899,Hartford Athletic,41.7539073,-72.661055,0.5661312531377349,0.4491630357848076
Hartford Athletic vs. Loudoun United FC,2025-06-20,Hartford Athletic,41.7539073,-72.661055,Monterey Bay FC,36.652918,-121.809193,0.0371633490808742,0.3694299525093979
Monterey Bay FC vs. El Paso Locomotive FC,2025-06-21,Monterey Bay FC,36.652918,-121.809193,Loudoun United FC,39.069037,-77.5455554,0.1190140692716298,0.4273771433251442
Loudoun United FC vs. Louisville City FC,2025-06-25,Loudoun United FC,39.069037,-77.5455554,AV Alta FC,34.7016636,-118.1748123,0.1741481669759806,0.4730243335003162
AV Alta FC vs. FC Naples,2025-06-28,AV Alta FC,34.7016636,-118.1748123,Portland Hearts of Pine,43.6593917,-70.2638855,0.0436724016951911,0.3053383055309803
Spokane Velocity FC vs. Texoma FC,2025-07-02,Spokane Velocity FC,47.667363,-117.420367,Loudoun United FC,39.069037,-77.5455554,0.2413060970096429,0.3399805638491373
Loudoun United FC vs. Orange County SC,2025-07-03,Loudoun United FC,39.069037,-77.5455554,Las Vegas Lights FC,36.17879868,-115.1350327,0.2456331006833354,0.4634094616935756
Las Vegas Lights FC vs. Sacramento Republic FC,2025-07-04,Las Vegas Lights FC,36.17879868,-115.1350327,Rhode Island FC,41.8684026,-71.3831786,0.1341773814387361,0.3898361499496388
Oakland Roots SC vs. Detroit City FC,2025-07-05,Oakland Roots SC,37.7255905,-122.2324865,Portland Hearts of Pine,43.6593917,-70.2638855,0.0042654707356255,0.3746086944378253
Portland Hearts of Pine vs. South Georgia Tormenta FC,2025-07-06,Portland Hearts of Pine,43.6593917,-70.2638855,North Carolina FC,35.7873226,-78.7542068,0.7410788519396856,0.2601797950717164
North Carolina FC vs. Birmingham Legion FC,2025-07-11,North Carolina FC,35.7873226,-78.7542068,Monterey Bay FC,36.652918,-121.809193,0.1250451457314561,0.3591858147022975
Monterey Bay FC vs. Orange County SC,2025-07-12,Monterey Bay FC,36.652918,-121.809193,Pittsburgh Riverhounds FC,40.41973877,-80.0602951,0.1727415871500509,0.4417642746749864
Pittsburgh Riverhounds FC vs. Loudoun United FC,2025-07-13,Pittsburgh Riverhounds FC,40.41973877,-80.0602951,FC Tulsa,36.0463933,-95.9494684,0.6647979278300913,0.367522612085947
Portland Hearts of Pine vs. Greenville Triumph SC,2025-07-16,Portland Hearts of Pine,43.6593917,-70.2638855,Union Omaha,41.15111542,-96.10290527,0.5131080155643848,0.2964942955883849
North Carolina FC vs. Indy Eleven,2025-07-18,North Carolina FC,35.7873226,-78.7542068,Sacramento Republic FC,38.5616356,-121.4907504,0.1400098531234913,0.398540344873871
Sacramento Republic FC vs. Lexington SC,2025-07-19,Sacramento Republic FC,38.5616356,-121.4907504,Greenville Triumph SC,34.8511,-82.3988,0.2044781344612363,0.4061267132384578
Greenville Triumph SC vs. Richmond Kickers,2025-07-20,Greenville Triumph SC,34.8511,-82.3988,Forward Madison FC,43.08438492,-89.37054443,0.7505181980663675,0.3130431992701478
Forward Madison FC vs. South Georgia Tormenta FC,2025-07-23,Forward Madison FC,43.08438492,-89.37054443,Houston Dynamo FC,29.7513,-95.3578,0.6415606823292757,0.2723830792311201
Houston Dynamo FC vs. Los Angeles Galaxy,2025-07-25,Houston Dynamo FC,29.7513,-95.3578,Pittsburgh Riverhounds FC,40.41973877,-80.0602951,0.5841906367575266,0.4675908129925042
Pittsburgh Riverhounds FC vs. Miami FC,2025-07-29,Pittsburgh Riverhounds FC,40.41973877,-80.0602951,Orange County SC,36.216459,-119.328777,0.2167095309028858,0.3259207033416597
Orange County SC vs. Phoenix Rising FC,2025-07-30,Orange County SC,36.216459,-119.328777,Westchester SC,40.711376,-74.004442,0.1014037364546477,0.4473807668645337
Westchester SC vs. Chattanooga Red Wolves SC,2025-08-01,Westchester SC,40.711376,-74.004442,Spokane Velocity FC,47.667363,-117.420367,0.2006347559281012,0.2681556866855846
Richmond Kickers vs. FC Naples,2025-08-02,Richmond Kickers,37.5817846,-77.4884784,Monterey Bay FC,36.652918,-121.809193,0.1105035092548473,0.3028073575741508
Monterey Bay FC vs. FC Tulsa,2025-08-06,Monterey Bay FC,36.652918,-121.809193,Rhode Island FC,41.8684026,-71.3831786,0.0137474283800276,0.4367926824236963
Oakland Roots SC vs. Colorado Springs Switchbacks FC,2025-08-09,Oakland Roots SC,37.7255905,-122.2324865,Westchester SC,40.711376,-74.004442,0.0597871054116055,0.337028616217577
Westchester SC vs. South Georgia Tormenta FC,2025-08-10,Westchester SC,40.711376,-74.004442,North Carolina FC,35.7873226,-78.7542068,0.8435557377094003,0.2484568888108528
North Carolina FC vs. Detroit City FC,2025-08-15,North Carolina FC,35.7873226,-78.7542068,Sacramento Republic FC,38.5616356,-121.4907504,0.1400098531234913,0.4266736161197729
Sacramento Republic FC vs. Oakland Roots SC,2025-08-16,Sacramento Republic FC,38.5616356,-121.4907504,Portland Hearts of Pine,43.6593917,-70.2638855,0.0266444323150512,0.381233575621738
Portland Hearts of Pine vs. Spokane Velocity FC,2025-08-17,Portland Hearts of Pine,43.6593917,-70.2638855,Orange County SC,36.216459,-119.328777,0.0402916586604782,0.3567185142369338
Orange County SC vs. San Antonio FC,2025-08-20,Orange County SC,36.216459,-119.328777,Forward Madison FC,43.08438492,-89.37054443,0.3924936253727863,0.4356201370814108
Forward Madison FC vs. Spokane Velocity FC,2025-08-21,Forward Madison FC,43.08438492,-89.37054443,Monterey Bay FC,36.652918,-121.809193,0.3513427524778956,0.3689217983963375
Monterey Bay FC vs. San Antonio FC,2025-08-23,Monterey Bay FC,36.652918,-121.809193,Westchester SC,40.711376,-74.004442,0.0582093233136452,0.4138616040130674
Westchester SC vs. Portland Hearts of Pine,2025-08-24,Westchester SC,40.711376,-74.004442,Forward Madison FC,43.08438492,-89.37054443,0.7037185409487399,0.2484396503695176
One Knoxville SC vs. FC Naples,2025-08-27,One Knoxville SC,35.97233,-83.915533,Oakland Roots SC,37.7255905,-122.2324865,0.2253820429133967,0.3410813531592935
Oakland Roots SC vs. Monterey Bay FC,2025-08-30,Oakland Roots SC,37.7255905,-122.2324865,One Knoxville SC,35.97233,-83.915533,0.2253820429133967,0.3574856239559836
One Knoxville SC vs. Spokane Velocity FC,2025-08-31,One Knoxville SC,35.97233,-83.915533,Hartford Athletic,41.7539073,-72.661055,0.7339912693951809,0.4115414135038395
Hartford Athletic vs. Indy Eleven,2025-09-03,Hartford Athletic,41.7539073,-72.661055,Phoenix Rising FC,33.4586015,-112.069558,0.1873745744563019,0.3367745647267485
Phoenix Rising FC vs. Las Vegas Lights FC,2025-09-05,Phoenix Rising FC,33.4586015,-112.069558,Rhode Island FC,41.8684026,-71.3831786,0.1631074898575651,0.3717046904734317
Miami FC vs. Hartford Athletic,2025-09-06,Miami FC,25.7639,-80.1899,Spokane Velocity FC,47.667363,-117.420367,0.0752507732486265,0.3278280437651106
New Mexico United vs. Detroit City FC,2025-09-10,New Mexico United,35.0795,-106.606,North Carolina FC,35.7873226,-78.7542068,0.4253165370303032,0.3988569321162881
North Carolina FC vs. El Paso Locomotive FC,2025-09-12,North Carolina FC,35.7873226,-78.7542068,Sacramento Republic FC,38.5616356,-121.4907504,0.1400098531234913,0.4169219473564323
Sacramento Republic FC vs. Phoenix Rising FC,2025-09-13,Sacramento Republic FC,38.5616356,-121.4907504,Richmond Kickers,37.5817846,-77.4884784,0.1282855821759854,0.4493701854619447
Birmingham Legion FC vs. Tampa Bay Rowdies,2025-09-17,Birmingham Legion FC,33.5133982,-86.8009311,Oakland Roots SC,37.7255905,-122.2324865,0.2652017622989402,0.3619178453498226
Miami FC vs. Rhode Island FC,2025-09-20,Miami FC,25.7639,-80.1899,Spokane Velocity FC,47.667363,-117.420367,0.0752507732486265,0.3972896298420999
Westchester SC vs. Texoma FC,2025-09-21,Westchester SC,40.711376,-74.004442,Colorado Springs Switchbacks FC,38.8955559,-104.7132438,0.4019781882617611,0.2317016999817211
Colorado Springs Switchbacks FC vs. New Mexico United,2025-09-24,Colorado Springs Switchbacks FC,38.8955559,-104.7132438,North Carolina FC,35.7873226,-78.7542068,0.4717509185559877,0.3612768538960398
One Knoxville SC vs. Charlotte Independence,2025-09-26,One Knoxville SC,35.97233,-83.915533,Monterey Bay FC,36.652918,-121.809193,0.229376459237293,0.4006329278269441
Orange County SC vs. Charleston Battery,2025-09-27,Orange County SC,36.216459,-119.328777,Loudoun United FC,39.069037,-77.5455554,0.163908855347576,0.4908782905788491
Loudoun United FC vs. Tampa Bay Rowdies,2025-09-28,Loudoun United FC,39.069037,-77.5455554,Sacramento Republic FC,38.5616356,-121.4907504,0.1387827748121487,0.4339277633040455
One Knoxville SC vs. Chattanooga Red Wolves SC,2025-10-01,One Knoxville SC,35.97233,-83.915533,Charlotte Independence,35.2198156,-80.8292123,0.9334862495016464,0.3347014922133539
Phoenix Rising FC vs. New Mexico United,2025-10-04,Phoenix Rising FC,33.4586015,-112.069558,Rhode Island FC,41.8684026,-71.3831786,0.1631074898575651,0.3873503538239937
Union Omaha vs. FC Naples,2025-10-05,Union Omaha,41.15111542,-96.10290527,North Carolina FC,35.7873226,-78.7542068,0.6300646102546682,0.3115920672785532
Charlotte Independence vs. AV Alta FC,2025-10-10,Charlotte Independence,35.2198156,-80.8292123,Spokane Velocity FC,47.667363,-117.420367,0.2442770731512089,0.3648898801986309
Texoma FC vs. Richmond Kickers,2025-10-11,Texoma FC,33.63773,-96.60976,Westchester SC,40.711376,-74.004442,0.510526205012053,0.2599735099243476
Charlotte Independence vs. Chattanooga Red Wolves SC,2025-10-17,Charlotte Independence,35.2198156,-80.8292123,Orange County SC,36.216459,-119.328777,0.2109842510290149,0.3655260648761054
El Paso Locomotive FC vs. FC Tulsa,2025-10-18,El Paso Locomotive FC,31.763608,-106.484592,North Carolina FC,35.7873226,-78.7542068,0.407918079286421,0.4441640841421973
